trait,source,accession_or_url,case_count,control_count,ancestry,genome_build,access_status,local_path,notes
hodgkin_lymphoma,Cozen et al. Nat Commun 2014 meta-analysis,https://pmc.ncbi.nlm.nih.gov/articles/PMC4055950/,1816 discovery plus 1281 replication,7877 discovery plus 3218 replication,primarily European,TBD,publication_identified,,HL GWAS publication identified; final summary statistics availability still needs confirmation
dlbcl_european,Cerhan et al. Nat Genet 2014,https://www.nature.com/articles/ng.3105,3857 discovery plus 1359 replication,7666 discovery plus 4557 replication,European,TBD,publication_identified,,DLBCL GWAS publication identified; final summary statistics availability still needs confirmation
dlbcl_east_asian,Leukemia 2024 East Asian DLBCL meta-GWAS,https://www.nature.com/articles/s41375-024-02503-4,2888,12458,East Asian,TBD,publication_identified,,BioProject listed in publication; suitability for outcome MR needs confirmation
ptld,PTLD HLA association candidate,https://pubmed.ncbi.nlm.nih.gov/25427163/,TBD,TBD,TBD,TBD,not_mr_ready,,PTLD genetics literature exists but no clearly MR-ready GWAS summary statistics identified in this pass
immune_comparator_multiple_sclerosis,IEU OpenGWAS ieu-a-1024 Sawcer/IMSGC 2011,https://gwas.mrcieu.ac.uk/datasets/ieu-a-1024/,9722,17376,European,hg19/GRCh37,open_vcf_download,,EBV-relevant autoimmune comparator; older but convenient OpenGWAS endpoint
immune_comparator_systemic_lupus_erythematosus,IEU OpenGWAS ebi-a-GCST003156 Bentham 2015,https://gwas.mrcieu.ac.uk/datasets/ebi-a-GCST003156/,5201,9066,European,hg19/GRCh37,open_vcf_download,,Autoimmune comparator; check allele harmonization before MR
immune_comparator_rheumatoid_arthritis,IEU OpenGWAS ieu-a-832 Okada 2014,https://gwas.mrcieu.ac.uk/datasets/ieu-a-832/,14361,43923,European,hg19/GRCh37,open_vcf_download,,Autoimmune comparator; source notes missing effect allele frequencies
immune_comparator_inflammatory_bowel_disease,IEU OpenGWAS ebi-a-GCST004131 de Lange 2017,https://gwas.mrcieu.ac.uk/datasets/ebi-a-GCST004131/,25042,34915,Mixed,hg19/GRCh37,open_vcf_download,,Immune comparator; mixed ancestry requires sensitivity analysis
